{
  "schemaName": "HandoffEnvelope",
  "schemaVersion": "1.0.0",
  "issuedUtc": "2026-01-13T00:00:00Z",
  "id": "ipc_test_handoff_001",
  "type": "command-batch.v1",
  "payload": {
    "schemaName": "CommandBatch",
    "schemaVersion": "1.0.0",
    "issuedUtc": "2026-01-13T00:00:00Z",
    "commands": [
      {
        "type": "delay",
        "delayMs": 1
      }
    ]
  }
}
